script/figure8/bert_coarse_int8_tvm-s/autotvm_tuned_bert_block_5000.log
{"input": ["cuda -keys=cuda,gpu -arch=sm_75 -max_num_threads=1024 -thread_warp_size=32", "dense_large_batch.gpu", [["TENSOR", [32, 768], "float32"], ["TENSOR", [2, 768], "float32"], null, "float32"], {}], "config": {"index": 12438, "code_hash": null, "entity": [["tile_x", "sp", [-1, 1, 2, 1]], ["tile_y", "sp", [-1, 1, 2, 1]], ["tile_k", "sp", [-1, 96, 4]]]}, "result": [[7.340884906846686e-06], 0, 5.649826288223267, 1639227027.1872017], "version": 0.2, "tvm_version": "0.9.dev0"}
{"input": ["cuda -keys=cuda,gpu -arch=sm_75 -max_num_threads=1024 -thread_warp_size=32", "dense_small_batch.gpu", [["TENSOR", [32, 768], "float32"], ["TENSOR", [2, 768], "float32"], null, "float32"], {}], "config": {"index": 9, "code_hash": null, "entity": [["tile_k", "sp", [-1, 32]]]}, "result": [[2.1294472651864376e-06], 0, 1.4850773811340332, 1639232532.4580092], "version": 0.2, "tvm_version": "0.9.dev0"}
{"input": ["cuda -keys=cuda,gpu -arch=sm_75 -max_num_threads=1024 -thread_warp_size=32", "dense_large_batch.gpu", [["TENSOR", [32, 768], "float32"], ["TENSOR", [768, 768], "float32"], null, "float32"], {}], "config": {"index": 373368, "code_hash": null, "entity": [["tile_x", "sp", [-1, 2, 8, 1]], ["tile_y", "sp", [-1, 3, 8, 1]], ["tile_k", "sp", [-1, 48, 1]]]}, "result": [[3.3762792877492875e-05], 0, 2.6349430084228516, 1639246813.6740568], "version": 0.2, "tvm_version": "0.9.dev0"}
{"input": ["cuda -keys=cuda,gpu -arch=sm_75 -max_num_threads=1024 -thread_warp_size=32", "dense_small_batch.gpu", [["TENSOR", [32, 768], "float32"], ["TENSOR", [768, 768], "float32"], null, "float32"], {}], "config": {"index": 9, "code_hash": null, "entity": [["tile_k", "sp", [-1, 32]]]}, "result": [[4.5699454494064444e-05], 0, 1.8757073879241943, 1639248482.967947], "version": 0.2, "tvm_version": "0.9.dev0"}
{"input": ["cuda -keys=cuda,gpu -arch=sm_75 -max_num_threads=1024 -thread_warp_size=32", "dense_large_batch.gpu", [["TENSOR", [4096, 3072], "float32"], ["TENSOR", [768, 3072], "float32"], null, "float32"], {}], "config": {"index": 8448944, "code_hash": null, "entity": [["tile_x", "sp", [-1, 8, 16, 1]], ["tile_y", "sp", [-1, 8, 16, 1]], ["tile_k", "sp", [-1, 12, 2]]]}, "result": [[0.0027786471428571428], 0, 7.7460315227508545, 1639261270.8522594], "version": 0.2, "tvm_version": "0.9.dev0"}
{"input": ["cuda -keys=cuda,gpu -arch=sm_75 -max_num_threads=1024 -thread_warp_size=32", "dense_small_batch.gpu", [["TENSOR", [4096, 3072], "float32"], ["TENSOR", [768, 3072], "float32"], null, "float32"], {}], "config": {"index": 11, "code_hash": null, "entity": [["tile_k", "sp", [-1, 64]]]}, "result": [[0.0637534162], 0, 3.012294292449951, 1639268077.0290534], "version": 0.2, "tvm_version": "0.9.dev0"}
{"input": ["cuda -keys=cuda,gpu -arch=sm_75 -max_num_threads=1024 -thread_warp_size=32", "dense_large_batch.gpu", [["TENSOR", [4096, 768], "float32"], ["TENSOR", [3072, 768], "float32"], null, "float32"], {}], "config": {"index": 19309794, "code_hash": null, "entity": [["tile_x", "sp", [-1, 8, 16, 1]], ["tile_y", "sp", [-1, 8, 16, 1]], ["tile_k", "sp", [-1, 8, 3]]]}, "result": [[0.00292237240625], 0, 4.59373664855957, 1639270402.3219428], "version": 0.2, "tvm_version": "0.9.dev0"}
{"input": ["cuda -keys=cuda,gpu -arch=sm_75 -max_num_threads=1024 -thread_warp_size=32", "dense_small_batch.gpu", [["TENSOR", [4096, 768], "float32"], ["TENSOR", [3072, 768], "float32"], null, "float32"], {}], "config": {"index": 14, "code_hash": null, "entity": [["tile_k", "sp", [-1, 192]]]}, "result": [[0.0662794897], 0, 3.8013088703155518, 1639291956.7590795], "version": 0.2, "tvm_version": "0.9.dev0"}
{"input": ["cuda -keys=cuda,gpu -arch=sm_75 -max_num_threads=1024 -thread_warp_size=32", "dense_large_batch.gpu", [["TENSOR", [4096, 768], "float32"], ["TENSOR", [768, 768], "float32"], null, "float32"], {}], "config": {"index": 14154644, "code_hash": null, "entity": [["tile_x", "sp", [-1, 8, 16, 1]], ["tile_y", "sp", [-1, 8, 16, 1]], ["tile_k", "sp", [-1, 6, 4]]]}, "result": [[0.0007326562301587301], 0, 6.551614999771118, 1639294000.0970714], "version": 0.2, "tvm_version": "0.9.dev0"}
{"input": ["cuda -keys=cuda,gpu -arch=sm_75 -max_num_threads=1024 -thread_warp_size=32", "dense_small_batch.gpu", [["TENSOR", [4096, 768], "float32"], ["TENSOR", [768, 768], "float32"], null, "float32"], {}], "config": {"index": 9, "code_hash": null, "entity": [["tile_k", "sp", [-1, 32]]]}, "result": [[0.005583912285714286], 0, 2.0024759769439697, 1639313931.5855513], "version": 0.2, "tvm_version": "0.9.dev0"}
