script/figure8/hubert_coarse_int8_tvm-s/autotvm_tuned_block_hubert_5000.log
{"input": ["cuda -keys=cuda,gpu -arch=sm_75 -max_num_threads=1024 -thread_warp_size=32", "dense_large_batch.gpu", [["TENSOR", [32, 256], "float32"], ["TENSOR", [12, 256], "float32"], null, "float32"], {}], "config": {"index": 50019, "code_hash": null, "entity": [["tile_x", "sp", [-1, 1, 4, 1]], ["tile_y", "sp", [-1, 1, 4, 1]], ["tile_k", "sp", [-1, 32, 4]]]}, "result": [[2.817008228868067e-06], 0, 1.9921834468841553, 1639231144.0648336], "version": 0.2, "tvm_version": "0.9.dev0"}
{"input": ["cuda -keys=cuda,gpu -arch=sm_75 -max_num_threads=1024 -thread_warp_size=32", "dense_small_batch.gpu", [["TENSOR", [32, 256], "float32"], ["TENSOR", [12, 256], "float32"], null, "float32"], {}], "config": {"index": 5, "code_hash": null, "entity": [["tile_k", "sp", [-1, 32]]]}, "result": [[2.1361249713971905e-06], 0, 1.319143295288086, 1639233443.8754377], "version": 0.2, "tvm_version": "0.9.dev0"}
{"input": ["cuda -keys=cuda,gpu -arch=sm_75 -max_num_threads=1024 -thread_warp_size=32", "dense_large_batch.gpu", [["TENSOR", [1568, 768], "float32"], ["TENSOR", [256, 768], "float32"], null, "float32"], {}], "config": {"index": 884836, "code_hash": null, "entity": [["tile_x", "sp", [-1, 7, 4, 1]], ["tile_y", "sp", [-1, 2, 4, 4]], ["tile_k", "sp", [-1, 32, 1]]]}, "result": [[0.00028737923900573614], 0, 3.782238006591797, 1639235573.4367568], "version": 0.2, "tvm_version": "0.9.dev0"}
{"input": ["cuda -keys=cuda,gpu -arch=sm_75 -max_num_threads=1024 -thread_warp_size=32", "dense_small_batch.gpu", [["TENSOR", [1568, 768], "float32"], ["TENSOR", [256, 768], "float32"], null, "float32"], {}], "config": {"index": 9, "code_hash": null, "entity": [["tile_k", "sp", [-1, 32]]]}, "result": [[0.0008174493989361703], 0, 1.2630131244659424, 1639249778.965593], "version": 0.2, "tvm_version": "0.9.dev0"}
{"input": ["cuda -keys=cuda,gpu -arch=sm_75 -max_num_threads=1024 -thread_warp_size=32", "dense_large_batch.gpu", [["TENSOR", [1568, 3072], "float32"], ["TENSOR", [768, 3072], "float32"], null, "float32"], {}], "config": {"index": 20725077, "code_hash": null, "entity": [["tile_x", "sp", [-1, 8, 4, 1]], ["tile_y", "sp", [-1, 12, 4, 1]], ["tile_k", "sp", [-1, 4, 4]]]}, "result": [[0.0019268023333333332], 0, 3.621455669403076, 1639251197.673567], "version": 0.2, "tvm_version": "0.9.dev0"}
{"input": ["cuda -keys=cuda,gpu -arch=sm_75 -max_num_threads=1024 -thread_warp_size=32", "dense_small_batch.gpu", [["TENSOR", [1568, 3072], "float32"], ["TENSOR", [768, 3072], "float32"], null, "float32"], {}], "config": {"index": 11, "code_hash": null, "entity": [["tile_k", "sp", [-1, 64]]]}, "result": [[0.0244564745], 0, 1.614616870880127, 1639265659.8315866], "version": 0.2, "tvm_version": "0.9.dev0"}
{"input": ["cuda -keys=cuda,gpu -arch=sm_75 -max_num_threads=1024 -thread_warp_size=32", "dense_large_batch.gpu", [["TENSOR", [1568, 768], "float32"], ["TENSOR", [3072, 768], "float32"], null, "float32"], {}], "config": {"index": 4517556, "code_hash": null, "entity": [["tile_x", "sp", [-1, 7, 4, 1]], ["tile_y", "sp", [-1, 12, 4, 1]], ["tile_k", "sp", [-1, 16, 1]]]}, "result": [[0.0018513124536082472], 0, 7.4690985679626465, 1639267367.8802354], "version": 0.2, "tvm_version": "0.9.dev0"}
{"input": ["cuda -keys=cuda,gpu -arch=sm_75 -max_num_threads=1024 -thread_warp_size=32", "dense_small_batch.gpu", [["TENSOR", [1568, 768], "float32"], ["TENSOR", [3072, 768], "float32"], null, "float32"], {}], "config": {"index": 14, "code_hash": null, "entity": [["tile_k", "sp", [-1, 192]]]}, "result": [[0.0253740876], 0, 1.7128562927246094, 1639280699.56185], "version": 0.2, "tvm_version": "0.9.dev0"}
{"input": ["cuda -keys=cuda,gpu -arch=sm_75 -max_num_threads=1024 -thread_warp_size=32", "dense_large_batch.gpu", [["TENSOR", [1568, 768], "float32"], ["TENSOR", [768, 768], "float32"], null, "float32"], {}], "config": {"index": 2733957, "code_hash": null, "entity": [["tile_x", "sp", [-1, 8, 4, 1]], ["tile_y", "sp", [-1, 4, 4, 3]], ["tile_k", "sp", [-1, 16, 1]]]}, "result": [[0.0004942802005813954], 0, 4.226014137268066, 1639281075.6039076], "version": 0.2, "tvm_version": "0.9.dev0"}
{"input": ["cuda -keys=cuda,gpu -arch=sm_75 -max_num_threads=1024 -thread_warp_size=32", "dense_small_batch.gpu", [["TENSOR", [1568, 768], "float32"], ["TENSOR", [768, 768], "float32"], null, "float32"], {}], "config": {"index": 9, "code_hash": null, "entity": [["tile_k", "sp", [-1, 32]]]}, "result": [[0.0021000356533333333], 0, 1.3455557823181152, 1639295090.8059535], "version": 0.2, "tvm_version": "0.9.dev0"}
{"input": ["cuda -keys=cuda,gpu -arch=sm_75 -max_num_threads=1024 -thread_warp_size=32", "dense_large_batch.gpu", [["TENSOR", [1568, 512], "float32"], ["TENSOR", [768, 512], "float32"], null, "float32"], {}], "config": {"index": 1625157, "code_hash": null, "entity": [["tile_x", "sp", [-1, 8, 4, 1]], ["tile_y", "sp", [-1, 4, 4, 3]], ["tile_k", "sp", [-1, 16, 1]]]}, "result": [[0.0003395894977375565], 0, 3.679457902908325, 1639295582.9581552], "version": 0.2, "tvm_version": "0.9.dev0"}
{"input": ["cuda -keys=cuda,gpu -arch=sm_75 -max_num_threads=1024 -thread_warp_size=32", "dense_small_batch.gpu", [["TENSOR", [1568, 512], "float32"], ["TENSOR", [768, 512], "float32"], null, "float32"], {}], "config": {"index": 5, "code_hash": null, "entity": [["tile_k", "sp", [-1, 32]]]}, "result": [[0.0014567807314814817], 0, 1.16463041305542, 1639308678.981377], "version": 0.2, "tvm_version": "0.9.dev0"}
{"input": ["cuda -keys=cuda,gpu -max_num_threads=1024 -thread_warp_size=32", "conv1d_ncw.cuda", [["TENSOR", [32, 512, 99], "float32"], ["TENSOR", [512, 512, 2], "float32"], [2], [0, 0], [1], "float32"], {}], "config": {"index": 28397902, "code_hash": null, "entity": [["tile_n", "sp", [-1, 2, 1, 2]], ["tile_f", "sp", [-1, 32, 1, 1]], ["tile_x", "sp", [-1, 1, 49, 1]], ["tile_rc", "sp", [-1, 1, 2]], ["auto_unroll_max_step", "ot", 512], ["unroll_explicit", "ot", 1]]}, "result": [[0.00045840664848484846], 0, 1.887531042098999, 1638029306.7319124], "version": 0.2, "tvm_version": "0.8.dev0"}
{"input": ["cuda -keys=cuda,gpu -max_num_threads=1024 -thread_warp_size=32", "conv1d_ncw.cuda", [["TENSOR", [32, 512, 199], "float32"], ["TENSOR", [512, 512, 2], "float32"], [2], [0, 0], [1], "float32"], {}], "config": {"index": 144603201, "code_hash": null, "entity": [["tile_n", "sp", [-1, 2, 1, 1]], ["tile_f", "sp", [-1, 32, 1, 2]], ["tile_x", "sp", [-1, 1, 99, 1]], ["tile_rc", "sp", [-1, 256, 2]], ["auto_unroll_max_step", "ot", 1500], ["unroll_explicit", "ot", 1]]}, "result": [[0.0006976874700460829], 0, 2.28078293800354, 1638034727.4508297], "version": 0.2, "tvm_version": "0.8.dev0"}
{"input": ["cuda -keys=cuda,gpu -max_num_threads=1024 -thread_warp_size=32", "conv1d_ncw.cuda", [["TENSOR", [32, 512, 399], "float32"], ["TENSOR", [512, 512, 3], "float32"], [2], [0, 0], [1], "float32"], {}], "config": {"index": 14129137, "code_hash": null, "entity": [["tile_n", "sp", [-1, 2, 1, 1]], ["tile_f", "sp", [-1, 2, 1, 32]], ["tile_x", "sp", [-1, 1, 199, 1]], ["tile_rc", "sp", [-1, 2, 2]], ["auto_unroll_max_step", "ot", 1500], ["unroll_explicit", "ot", 1]]}, "result": [[0.0019671748051948053], 0, 3.4138104915618896, 1638045816.005008], "version": 0.2, "tvm_version": "0.8.dev0"}
{"input": ["cuda -keys=cuda,gpu -max_num_threads=1024 -thread_warp_size=32", "conv1d_ncw.cuda", [["TENSOR", [32, 512, 799], "float32"], ["TENSOR", [512, 512, 3], "float32"], [2], [0, 0], [1], "float32"], {}], "config": {"index": 179288370, "code_hash": null, "entity": [["tile_n", "sp", [-1, 4, 1, 1]], ["tile_f", "sp", [-1, 4, 1, 8]], ["tile_x", "sp", [-1, 1, 133, 1]], ["tile_rc", "sp", [-1, 128, 1]], ["auto_unroll_max_step", "ot", 512], ["unroll_explicit", "ot", 1]]}, "result": [[0.0041977484722222225], 0, 2.459757089614868, 1638069948.5952113], "version": 0.2, "tvm_version": "0.8.dev0"}
{"input": ["cuda -keys=cuda,gpu -max_num_threads=1024 -thread_warp_size=32", "conv1d_ncw.cuda", [["TENSOR", [32, 512, 1599], "float32"], ["TENSOR", [512, 512, 3], "float32"], [2], [0, 0], [1], "float32"], {}], "config": {"index": 46406326, "code_hash": null, "entity": [["tile_n", "sp", [-1, 2, 1, 2]], ["tile_f", "sp", [-1, 1, 1, 16]], ["tile_x", "sp", [-1, 1, 47, 1]], ["tile_rc", "sp", [-1, 32, 2]], ["auto_unroll_max_step", "ot", 512], ["unroll_explicit", "ot", 1]]}, "result": [[0.013219921875], 0, 3.098267078399658, 1638080786.340055], "version": 0.2, "tvm_version": "0.8.dev0"}
{"input": ["cuda -keys=cuda,gpu -max_num_threads=1024 -thread_warp_size=32", "conv1d_ncw.cuda", [["TENSOR", [32, 512, 3199], "float32"], ["TENSOR", [512, 512, 3], "float32"], [2], [0, 0], [1], "float32"], {}], "config": {"index": 173745882, "code_hash": null, "entity": [["tile_n", "sp", [-1, 4, 1, 1]], ["tile_f", "sp", [-1, 2, 1, 16]], ["tile_x", "sp", [-1, 1, 123, 1]], ["tile_rc", "sp", [-1, 1, 1]], ["auto_unroll_max_step", "ot", 512], ["unroll_explicit", "ot", 1]]}, "result": [[0.0139154780625], 0, 3.8160693645477295, 1638087477.8159118], "version": 0.2, "tvm_version": "0.8.dev0"}
{"input": ["cuda -keys=cuda,gpu -max_num_threads=1024 -thread_warp_size=32", "conv1d_ncw.cuda", [["TENSOR", [32, 1, 16000], "float32"], ["TENSOR", [512, 1, 10], "float32"], [5], [0, 0], [1], "float32"], {}], "config": {"index": 468441, "code_hash": null, "entity": [["tile_n", "sp", [-1, 2, 1, 1]], ["tile_f", "sp", [-1, 32, 1, 1]], ["tile_x", "sp", [-1, 1, 457, 1]], ["tile_rc", "sp", [-1, 1, 1]], ["auto_unroll_max_step", "ot", 1500], ["unroll_explicit", "ot", 0]]}, "result": [[0.00044583123428571425], 0, 3.04604434967041, 1638106587.3881543], "version": 0.2, "tvm_version": "0.8.dev0"}
{"input": ["cuda -keys=cuda,gpu -max_num_threads=1024 -thread_warp_size=32", "batch_matmul.cuda", [["TENSOR", [384, 49, 49], "float32"], ["TENSOR", [384, 64, 49], "float32"], [384, 49, 64], null, 0, 1], {}], "config": {"index": 3964, "code_hash": null, "entity": [["tile_y", "sp", [-1, 7, 7]], ["tile_x", "sp", [-1, 8, 4]], ["tile_k", "sp", [-1, 49]], ["auto_unroll_max_step", "ot", 64], ["unroll_explicit", "ot", 1]]}, "result": [[3.8724637204522095e-05], 0, 1.7435100078582764, 1638117534.8364954], "version": 0.2, "tvm_version": "0.8.dev0"}
{"input": ["cuda -keys=cuda,gpu -max_num_threads=1024 -thread_warp_size=32", "batch_matmul.cuda", [["TENSOR", [384, 49, 64], "float32"], ["TENSOR", [384, 49, 64], "float32"], [384, 49, 49], null, 0, 1], {}], "config": {"index": 604, "code_hash": null, "entity": [["tile_y", "sp", [-1, 7, 7]], ["tile_x", "sp", [-1, 7, 7]], ["tile_k", "sp", [-1, 4]], ["auto_unroll_max_step", "ot", 32], ["unroll_explicit", "ot", 0]]}, "result": [[4.7391990869017635e-05], 0, 1.6415271759033203, 1638123035.5839002], "version": 0.2, "tvm_version": "0.8.dev0"}
{"input": ["cuda -keys=cuda,gpu -max_num_threads=1024 -thread_warp_size=32", "group_conv2d_nchw.cuda", [["TENSOR", [32, 768, 1, 49], "float32"], ["TENSOR", [768, 48, 1, 128], "float32"], [1, 1], [0, 64, 0, 64], [1, 1], 16, "float32"], {}], "config": {"index": 680074098, "code_hash": null, "entity": [["tile_n", "sp", [-1, 1, 16, 1]], ["tile_g", "sp", [-1, 1]], ["tile_f", "sp", [-1, 2, 4, 6]], ["tile_y", "sp", [-1, 1, 1, 1]], ["tile_x", "sp", [-1, 1, 2, 5]], ["tile_rc", "sp", [-1, 4]], ["tile_ry", "sp", [-1, 1]], ["tile_rx", "sp", [-1, 8]], ["auto_unroll_max_step", "ot", 1500], ["unroll_explicit", "ot", 1], ["fuse_yx", "ot", 0]]}, "result": [[0.0022749259746835445], 0, 1.866126298904419, 1638132057.7597284], "version": 0.2, "tvm_version": "0.8.dev0"}