script/figure8/hubert_finegrained_tvm-s/autotvm_tuned_fine_hubert_5000.log
{"input": ["cuda -keys=cuda,gpu -arch=sm_75 -max_num_threads=1024 -thread_warp_size=32", "dense_large_batch.gpu", [["TENSOR", [32, 256], "float32"], ["TENSOR", [12, 256], "float32"], null, "float32"], {}], "config": {"index": 34339, "code_hash": null, "entity": [["tile_x", "sp", [-1, 1, 4, 1]], ["tile_y", "sp", [-1, 1, 4, 1]], ["tile_k", "sp", [-1, 64, 2]]]}, "result": [[2.789165204365504e-06], 0, 2.8566043376922607, 1639231568.1702974], "version": 0.2, "tvm_version": "0.9.dev0"}
{"input": ["cuda -keys=cuda,gpu -arch=sm_75 -max_num_threads=1024 -thread_warp_size=32", "dense_small_batch.gpu", [["TENSOR", [32, 256], "float32"], ["TENSOR", [12, 256], "float32"], null, "float32"], {}], "config": {"index": 4, "code_hash": null, "entity": [["tile_k", "sp", [-1, 16]]]}, "result": [[2.580778704714986e-06], 0, 1.6889216899871826, 1639236108.0870116], "version": 0.2, "tvm_version": "0.9.dev0"}
{"input": ["cuda -keys=cuda,gpu -arch=sm_75 -max_num_threads=1024 -thread_warp_size=32", "dense_large_batch.gpu", [["TENSOR", [1568, 768], "float32"], ["TENSOR", [256, 768], "float32"], null, "float32"], {}], "config": {"index": 760010, "code_hash": null, "entity": [["tile_x", "sp", [-1, 1, 32, 1]], ["tile_y", "sp", [-1, 4, 32, 1]], ["tile_k", "sp", [-1, 24, 1]]]}, "result": [[0.00044185542857142857], 0, 2.324784994125366, 1639236584.8365245], "version": 0.2, "tvm_version": "0.9.dev0"}
{"input": ["cuda -keys=cuda,gpu -arch=sm_75 -max_num_threads=1024 -thread_warp_size=32", "dense_small_batch.gpu", [["TENSOR", [1568, 768], "float32"], ["TENSOR", [256, 768], "float32"], null, "float32"], {}], "config": {"index": 9, "code_hash": null, "entity": [["tile_k", "sp", [-1, 32]]]}, "result": [[0.0007987440860927152], 0, 1.6412220001220703, 1639246338.5017257], "version": 0.2, "tvm_version": "0.9.dev0"}
{"input": ["cuda -keys=cuda,gpu -arch=sm_75 -max_num_threads=1024 -thread_warp_size=32", "dense_large_batch.gpu", [["TENSOR", [1568, 3072], "float32"], ["TENSOR", [768, 3072], "float32"], null, "float32"], {}], "config": {"index": 21117118, "code_hash": null, "entity": [["tile_x", "sp", [-1, 7, 16, 1]], ["tile_y", "sp", [-1, 8, 16, 1]], ["tile_k", "sp", [-1, 6, 4]]]}, "result": [[0.0014965575341614908], 0, 3.425600051879883, 1639248357.2422004], "version": 0.2, "tvm_version": "0.9.dev0"}
{"input": ["cuda -keys=cuda,gpu -arch=sm_75 -max_num_threads=1024 -thread_warp_size=32", "dense_small_batch.gpu", [["TENSOR", [1568, 3072], "float32"], ["TENSOR", [768, 3072], "float32"], null, "float32"], {}], "config": {"index": 15, "code_hash": null, "entity": [["tile_k", "sp", [-1, 256]]]}, "result": [[0.0347755119], 0, 2.131868839263916, 1639257692.2133148], "version": 0.2, "tvm_version": "0.9.dev0"}
{"input": ["cuda -keys=cuda,gpu -arch=sm_75 -max_num_threads=1024 -thread_warp_size=32", "dense_large_batch.gpu", [["TENSOR", [1568, 768], "float32"], ["TENSOR", [3072, 768], "float32"], null, "float32"], {}], "config": {"index": 30172318, "code_hash": null, "entity": [["tile_x", "sp", [-1, 7, 16, 1]], ["tile_y", "sp", [-1, 8, 16, 1]], ["tile_k", "sp", [-1, 6, 4]]]}, "result": [[0.0015621508], 0, 3.5186970233917236, 1639262215.1153648], "version": 0.2, "tvm_version": "0.9.dev0"}
{"input": ["cuda -keys=cuda,gpu -arch=sm_75 -max_num_threads=1024 -thread_warp_size=32", "dense_small_batch.gpu", [["TENSOR", [1568, 768], "float32"], ["TENSOR", [3072, 768], "float32"], null, "float32"], {}], "config": {"index": 13, "code_hash": null, "entity": [["tile_k", "sp", [-1, 128]]]}, "result": [[0.034889382999999996], 0, 2.135136365890503, 1639269057.8257751], "version": 0.2, "tvm_version": "0.9.dev0"}
{"input": ["cuda -keys=cuda,gpu -arch=sm_75 -max_num_threads=1024 -thread_warp_size=32", "dense_large_batch.gpu", [["TENSOR", [1568, 768], "float32"], ["TENSOR", [768, 768], "float32"], null, "float32"], {}], "config": {"index": 13725363, "code_hash": null, "entity": [["tile_x", "sp", [-1, 1, 16, 7]], ["tile_y", "sp", [-1, 8, 16, 1]], ["tile_k", "sp", [-1, 8, 3]]]}, "result": [[0.00039763768354430384], 0, 3.6311850547790527, 1639279341.898807], "version": 0.2, "tvm_version": "0.9.dev0"}
{"input": ["cuda -keys=cuda,gpu -arch=sm_75 -max_num_threads=1024 -thread_warp_size=32", "dense_small_batch.gpu", [["TENSOR", [1568, 768], "float32"], ["TENSOR", [768, 768], "float32"], null, "float32"], {}], "config": {"index": 9, "code_hash": null, "entity": [["tile_k", "sp", [-1, 32]]]}, "result": [[0.002190581536231884], 0, 1.4244985580444336, 1639280192.200759], "version": 0.2, "tvm_version": "0.9.dev0"}
{"input": ["cuda -keys=cuda,gpu -arch=sm_75 -max_num_threads=1024 -thread_warp_size=32", "dense_large_batch.gpu", [["TENSOR", [1568, 512], "float32"], ["TENSOR", [768, 512], "float32"], null, "float32"], {}], "config": {"index": 4855838, "code_hash": null, "entity": [["tile_x", "sp", [-1, 7, 16, 1]], ["tile_y", "sp", [-1, 16, 16, 1]], ["tile_k", "sp", [-1, 8, 2]]]}, "result": [[0.0002917476746987952], 0, 3.339798927307129, 1639281188.7885625], "version": 0.2, "tvm_version": "0.9.dev0"}
{"input": ["cuda -keys=cuda,gpu -arch=sm_75 -max_num_threads=1024 -thread_warp_size=32", "dense_small_batch.gpu", [["TENSOR", [1568, 512], "float32"], ["TENSOR", [768, 512], "float32"], null, "float32"], {}], "config": {"index": 5, "code_hash": null, "entity": [["tile_k", "sp", [-1, 32]]]}, "result": [[0.0016500050862068964], 0, 1.5868163108825684, 1639290633.1167219], "version": 0.2, "tvm_version": "0.9.dev0"}
{"input": ["cuda -keys=cuda,gpu -max_num_threads=1024 -thread_warp_size=32", "conv1d_ncw.cuda", [["TENSOR", [32, 512, 99], "float32"], ["TENSOR", [512, 512, 2], "float32"], [2], [0, 0], [1], "float32"], {}], "config": {"index": 28397902, "code_hash": null, "entity": [["tile_n", "sp", [-1, 2, 1, 2]], ["tile_f", "sp", [-1, 32, 1, 1]], ["tile_x", "sp", [-1, 1, 49, 1]], ["tile_rc", "sp", [-1, 1, 2]], ["auto_unroll_max_step", "ot", 512], ["unroll_explicit", "ot", 1]]}, "result": [[0.00045840664848484846], 0, 1.887531042098999, 1638029306.7319124], "version": 0.2, "tvm_version": "0.8.dev0"}
{"input": ["cuda -keys=cuda,gpu -max_num_threads=1024 -thread_warp_size=32", "conv1d_ncw.cuda", [["TENSOR", [32, 512, 199], "float32"], ["TENSOR", [512, 512, 2], "float32"], [2], [0, 0], [1], "float32"], {}], "config": {"index": 144603201, "code_hash": null, "entity": [["tile_n", "sp", [-1, 2, 1, 1]], ["tile_f", "sp", [-1, 32, 1, 2]], ["tile_x", "sp", [-1, 1, 99, 1]], ["tile_rc", "sp", [-1, 256, 2]], ["auto_unroll_max_step", "ot", 1500], ["unroll_explicit", "ot", 1]]}, "result": [[0.0006976874700460829], 0, 2.28078293800354, 1638034727.4508297], "version": 0.2, "tvm_version": "0.8.dev0"}
{"input": ["cuda -keys=cuda,gpu -max_num_threads=1024 -thread_warp_size=32", "conv1d_ncw.cuda", [["TENSOR", [32, 512, 399], "float32"], ["TENSOR", [512, 512, 3], "float32"], [2], [0, 0], [1], "float32"], {}], "config": {"index": 14129137, "code_hash": null, "entity": [["tile_n", "sp", [-1, 2, 1, 1]], ["tile_f", "sp", [-1, 2, 1, 32]], ["tile_x", "sp", [-1, 1, 199, 1]], ["tile_rc", "sp", [-1, 2, 2]], ["auto_unroll_max_step", "ot", 1500], ["unroll_explicit", "ot", 1]]}, "result": [[0.0019671748051948053], 0, 3.4138104915618896, 1638045816.005008], "version": 0.2, "tvm_version": "0.8.dev0"}
{"input": ["cuda -keys=cuda,gpu -max_num_threads=1024 -thread_warp_size=32", "conv1d_ncw.cuda", [["TENSOR", [32, 512, 799], "float32"], ["TENSOR", [512, 512, 3], "float32"], [2], [0, 0], [1], "float32"], {}], "config": {"index": 179288370, "code_hash": null, "entity": [["tile_n", "sp", [-1, 4, 1, 1]], ["tile_f", "sp", [-1, 4, 1, 8]], ["tile_x", "sp", [-1, 1, 133, 1]], ["tile_rc", "sp", [-1, 128, 1]], ["auto_unroll_max_step", "ot", 512], ["unroll_explicit", "ot", 1]]}, "result": [[0.0041977484722222225], 0, 2.459757089614868, 1638069948.5952113], "version": 0.2, "tvm_version": "0.8.dev0"}
{"input": ["cuda -keys=cuda,gpu -max_num_threads=1024 -thread_warp_size=32", "conv1d_ncw.cuda", [["TENSOR", [32, 512, 1599], "float32"], ["TENSOR", [512, 512, 3], "float32"], [2], [0, 0], [1], "float32"], {}], "config": {"index": 46406326, "code_hash": null, "entity": [["tile_n", "sp", [-1, 2, 1, 2]], ["tile_f", "sp", [-1, 1, 1, 16]], ["tile_x", "sp", [-1, 1, 47, 1]], ["tile_rc", "sp", [-1, 32, 2]], ["auto_unroll_max_step", "ot", 512], ["unroll_explicit", "ot", 1]]}, "result": [[0.013219921875], 0, 3.098267078399658, 1638080786.340055], "version": 0.2, "tvm_version": "0.8.dev0"}
{"input": ["cuda -keys=cuda,gpu -max_num_threads=1024 -thread_warp_size=32", "conv1d_ncw.cuda", [["TENSOR", [32, 512, 3199], "float32"], ["TENSOR", [512, 512, 3], "float32"], [2], [0, 0], [1], "float32"], {}], "config": {"index": 173745882, "code_hash": null, "entity": [["tile_n", "sp", [-1, 4, 1, 1]], ["tile_f", "sp", [-1, 2, 1, 16]], ["tile_x", "sp", [-1, 1, 123, 1]], ["tile_rc", "sp", [-1, 1, 1]], ["auto_unroll_max_step", "ot", 512], ["unroll_explicit", "ot", 1]]}, "result": [[0.0139154780625], 0, 3.8160693645477295, 1638087477.8159118], "version": 0.2, "tvm_version": "0.8.dev0"}
{"input": ["cuda -keys=cuda,gpu -max_num_threads=1024 -thread_warp_size=32", "conv1d_ncw.cuda", [["TENSOR", [32, 1, 16000], "float32"], ["TENSOR", [512, 1, 10], "float32"], [5], [0, 0], [1], "float32"], {}], "config": {"index": 468441, "code_hash": null, "entity": [["tile_n", "sp", [-1, 2, 1, 1]], ["tile_f", "sp", [-1, 32, 1, 1]], ["tile_x", "sp", [-1, 1, 457, 1]], ["tile_rc", "sp", [-1, 1, 1]], ["auto_unroll_max_step", "ot", 1500], ["unroll_explicit", "ot", 0]]}, "result": [[0.00044583123428571425], 0, 3.04604434967041, 1638106587.3881543], "version": 0.2, "tvm_version": "0.8.dev0"}
{"input": ["cuda -keys=cuda,gpu -max_num_threads=1024 -thread_warp_size=32", "batch_matmul.cuda", [["TENSOR", [384, 49, 49], "float32"], ["TENSOR", [384, 64, 49], "float32"], [384, 49, 64], null, 0, 1], {}], "config": {"index": 3964, "code_hash": null, "entity": [["tile_y", "sp", [-1, 7, 7]], ["tile_x", "sp", [-1, 8, 4]], ["tile_k", "sp", [-1, 49]], ["auto_unroll_max_step", "ot", 64], ["unroll_explicit", "ot", 1]]}, "result": [[3.8724637204522095e-05], 0, 1.7435100078582764, 1638117534.8364954], "version": 0.2, "tvm_version": "0.8.dev0"}
{"input": ["cuda -keys=cuda,gpu -max_num_threads=1024 -thread_warp_size=32", "batch_matmul.cuda", [["TENSOR", [384, 49, 64], "float32"], ["TENSOR", [384, 49, 64], "float32"], [384, 49, 49], null, 0, 1], {}], "config": {"index": 604, "code_hash": null, "entity": [["tile_y", "sp", [-1, 7, 7]], ["tile_x", "sp", [-1, 7, 7]], ["tile_k", "sp", [-1, 4]], ["auto_unroll_max_step", "ot", 32], ["unroll_explicit", "ot", 0]]}, "result": [[4.7391990869017635e-05], 0, 1.6415271759033203, 1638123035.5839002], "version": 0.2, "tvm_version": "0.8.dev0"}
{"input": ["cuda -keys=cuda,gpu -max_num_threads=1024 -thread_warp_size=32", "group_conv2d_nchw.cuda", [["TENSOR", [32, 768, 1, 49], "float32"], ["TENSOR", [768, 48, 1, 128], "float32"], [1, 1], [0, 64, 0, 64], [1, 1], 16, "float32"], {}], "config": {"index": 680074098, "code_hash": null, "entity": [["tile_n", "sp", [-1, 1, 16, 1]], ["tile_g", "sp", [-1, 1]], ["tile_f", "sp", [-1, 2, 4, 6]], ["tile_y", "sp", [-1, 1, 1, 1]], ["tile_x", "sp", [-1, 1, 2, 5]], ["tile_rc", "sp", [-1, 4]], ["tile_ry", "sp", [-1, 1]], ["tile_rx", "sp", [-1, 8]], ["auto_unroll_max_step", "ot", 1500], ["unroll_explicit", "ot", 1], ["fuse_yx", "ot", 0]]}, "result": [[0.0022749259746835445], 0, 1.866126298904419, 1638132057.7597284], "version": 0.2, "tvm_version": "0.8.dev0"}